{
  "protocol": "oebp",
  "version": "0.1.0",
  "kind": "ContextSnapshot",
  "metadata": {
    "id": "org.oebp.fixtures.context.updated",
    "revision": "1.0.0",
    "created_at": "2026-06-16T09:00:00Z"
  },
  "spec": {
    "snapshot_id": "snapshot-001",
    "observed_at": "2026-06-16T09:00:00Z",
    "robot_ref": "$robot",
    "frame": "world",
    "entities": [
      {
        "id": "$robot",
        "type": "robot",
        "properties": {
          "ready": true
        },
        "evidence": [
          {
            "source": "fixture.perception",
            "timestamp": "2026-06-16T09:00:00Z",
            "confidence": 0.9,
            "freshness_ms": 100
          }
        ]
      },
      {
        "id": "$object",
        "type": "object",
        "properties": {
          "mass_kg": 0.2
        },
        "evidence": [
          {
            "source": "fixture.perception",
            "timestamp": "2026-06-16T09:00:00Z",
            "confidence": 0.9,
            "freshness_ms": 100
          }
        ]
      }
    ],
    "relations": [
      {
        "predicate": "oebp.relation.visible_to",
        "subject": "$object",
        "object": "$robot",
        "evidence": [
          {
            "source": "fixture.perception",
            "timestamp": "2026-06-16T09:00:00Z",
            "confidence": 0.9,
            "freshness_ms": 100
          }
        ]
      }
    ],
    "facts": [
      {
        "name": "oebp.state.ready",
        "subject": "$robot",
        "value": true,
        "evidence": [
          {
            "source": "fixture.perception",
            "timestamp": "2026-06-16T09:00:00Z",
            "confidence": 0.9,
            "freshness_ms": 100
          }
        ]
      }
    ]
  }
}
